{
  "session_id": "6f1c2b9e-3a47-4d0e-9b8a-2c5d7e1f0a34",
  "transcript_path": "/home/user/.claude/projects/-home-user-Seldon/6f1c2b9e-3a47-4d0e-9b8a-2c5d7e1f0a34.jsonl",
  "cwd": "/home/user/Seldon",
  "permission_mode": "default",
  "hook_event_name": "PreToolUse",
  "tool_name": "Bash",
  "tool_use_id": "toolu_01Hk7mX2qZP9wA3bC4dE5fG6",
  "tool_input": {
    "command": "yay -S --noconfirm zed",
    "description": "Install the Zed editor"
  }
}
