{
  "session_id": "6f1c2b9e-3a47-4d0e-9b8a-2c5d7e1f0a34",
  "transcript_path": "/home/user/.claude/projects/-home-user-Seldon/6f1c2b9e-3a47-4d0e-9b8a-2c5d7e1f0a34.jsonl",
  "cwd": "/home/user/.config/hypr",
  "permission_mode": "acceptEdits",
  "hook_event_name": "PostToolUse",
  "tool_name": "Bash",
  "tool_use_id": "toolu_01Kn9pZ4sBR1yC5dE6fG7hJ8",
  "tool_input": {
    "command": "AWS_ACCESS_KEY_ID=AKIAIOSFODNN7EXAMPLE git -C ~/.config/hypr push https://user:ghp_EXAMPLEexample0000000000000000000000@github.com/example/dotfiles.git main --password hunter2",
    "description": "Push hypr config to the dotfiles remote"
  },
  "tool_response": {
    "stdout": "",
    "stderr": "To https://github.com/example/dotfiles.git\n   3b38586..09688c6  main -> main\nremote: token=sk-EXAMPLE0000000000000000000000 (this must never be recorded)\n",
    "interrupted": false,
    "isImage": false
  }
}
